[
  {
    "person_id": "person-BATCH-2026-005-edoardo-debenedetti",
    "canonical_name": "Edoardo Debenedetti",
    "display_name": "Edoardo Debenedetti",
    "alternate_names": [
      "E. Debenedetti"
    ],
    "name_disambiguation_note": "The AgentDojo first author who is listed as a PhD student in Florian Tramèr's ETH Zurich SPY Lab.",
    "external_identifiers": {
      "personal_website": "https://edoardo.science/"
    },
    "current_role": "PhD Student",
    "current_organization_reference": "ETH Zurich",
    "current_role_source": "https://spylab.ai/",
    "current_role_verified_at": "2026-08-15",
    "current_role_freshness_status": "current_official_lab_page_checked_2026-08-15",
    "historical_roles": [
      {
        "person_id": "person-BATCH-2026-005-edoardo-debenedetti",
        "source_id": "source-BATCH-2026-005-006",
        "source_title": "AgentDojo: A Dynamic Environment to Evaluate Prompt Injection Attacks and Defenses for LLM Agents",
        "source_version": "arXiv v3",
        "relationship": "author",
        "author_order": 1,
        "organization_at_source_time": "ETH Zurich",
        "role_at_source_time": "Author",
        "verification_basis": "PDF title or contributor page",
        "verification_status": "verified_from_source_byline_and_affiliation",
        "current_role_backfilled": false,
        "human_review_status": "pending"
      }
    ],
    "role_at_source_time": [
      {
        "person_id": "person-BATCH-2026-005-edoardo-debenedetti",
        "source_id": "source-BATCH-2026-005-006",
        "source_title": "AgentDojo: A Dynamic Environment to Evaluate Prompt Injection Attacks and Defenses for LLM Agents",
        "source_version": "arXiv v3",
        "relationship": "author",
        "author_order": 1,
        "organization_at_source_time": "ETH Zurich",
        "role_at_source_time": "Author",
        "verification_basis": "PDF title or contributor page",
        "verification_status": "verified_from_source_byline_and_affiliation",
        "current_role_backfilled": false,
        "human_review_status": "pending"
      }
    ],
    "professional_geographies": [
      "Switzerland"
    ],
    "operating_markets": [],
    "languages": [],
    "expertise_topics": [
      "AI agent security",
      "prompt injection evaluation"
    ],
    "authored_book_work_ids": [],
    "contributed_work_ids": [
      "source-BATCH-2026-005-006"
    ],
    "source_ids": [
      "source-BATCH-2026-005-006"
    ],
    "statement_ids": [
      "statement-BATCH-2026-006-022",
      "statement-BATCH-2026-006-023",
      "statement-BATCH-2026-006-024",
      "statement-BATCH-2026-006-025",
      "statement-BATCH-2026-006-026",
      "statement-BATCH-2026-006-027"
    ],
    "proposition_relationships": [],
    "relationship_to_off": "none_identified",
    "disclosure": null,
    "public_profile_eligibility": false,
    "verification_status": "identity_authorship_and_current_role_machine_verified_human_review_pending",
    "person_depth": "source_connected_dataset_only",
    "workflow_status": "metadata_verified",
    "machine_review_status": "ready_for_human_review",
    "human_review_status": "pending",
    "reviewed_by": null,
    "reviewed_at": null,
    "provenance": [
      {
        "source_url": "https://spylab.ai/",
        "accessed_at": "2026-08-15",
        "retrieval_method": "official institutional/company page or self-authored professional CV reviewed on the public web",
        "exact_locator": "People — Edoardo Debenedetti — PhD Student",
        "content_hash": null,
        "batch_id": "BATCH-2026-007",
        "prompt_id": "OEII-PERSON-RESEARCH",
        "prompt_version": "2.0",
        "notes": "Current-role evidence; named human review pending."
      },
      {
        "source_url": "https://arxiv.org/abs/2406.13352",
        "accessed_at": "2026-08-15",
        "retrieval_method": "inherited verified source metadata and author relationship cross-check",
        "exact_locator": "arXiv v3; byline/contributor relationship and source-time affiliation",
        "content_hash": "349884fffbf43282591c5accffd57bb651632f38e412fe303114941bdd111b05",
        "batch_id": "BATCH-2026-007",
        "prompt_id": "OEII-PERSON-RESEARCH",
        "prompt_version": "2.0",
        "notes": "Relationship inherited from BATCH-2026-005 and rechecked for this person batch; named human review pending."
      }
    ],
    "revision_history": [
      {
        "changed_at": "2026-08-15T22:30:00Z",
        "changed_by": "OpenAI Codex",
        "summary": "Created staging person record with identity disambiguation, source-time role separation, current-role verification, and intellectual-contribution links.",
        "batch_id": "BATCH-2026-007"
      }
    ]
  },
  {
    "person_id": "person-BATCH-2026-005-jie-zhang",
    "canonical_name": "Jie Zhang",
    "display_name": "Jie Zhang",
    "alternate_names": [
      "J. Zhang"
    ],
    "name_disambiguation_note": "The AgentDojo coauthor in Florian Tramèr's ETH Zurich SPY Lab, not another researcher with the same name.",
    "external_identifiers": {
      "official_profile_url": "https://zj-jayzhang.github.io/"
    },
    "current_role": "PhD Student",
    "current_organization_reference": "ETH Zurich",
    "current_role_source": "https://spylab.ai/",
    "current_role_verified_at": "2026-08-15",
    "current_role_freshness_status": "current_official_lab_page_checked_2026-08-15",
    "historical_roles": [
      {
        "person_id": "person-BATCH-2026-005-jie-zhang",
        "source_id": "source-BATCH-2026-005-006",
        "source_title": "AgentDojo: A Dynamic Environment to Evaluate Prompt Injection Attacks and Defenses for LLM Agents",
        "source_version": "arXiv v3",
        "relationship": "author",
        "author_order": 2,
        "organization_at_source_time": "ETH Zurich",
        "role_at_source_time": "Author",
        "verification_basis": "PDF title or contributor page",
        "verification_status": "verified_from_source_byline_and_affiliation",
        "current_role_backfilled": false,
        "human_review_status": "pending"
      }
    ],
    "role_at_source_time": [
      {
        "person_id": "person-BATCH-2026-005-jie-zhang",
        "source_id": "source-BATCH-2026-005-006",
        "source_title": "AgentDojo: A Dynamic Environment to Evaluate Prompt Injection Attacks and Defenses for LLM Agents",
        "source_version": "arXiv v3",
        "relationship": "author",
        "author_order": 2,
        "organization_at_source_time": "ETH Zurich",
        "role_at_source_time": "Author",
        "verification_basis": "PDF title or contributor page",
        "verification_status": "verified_from_source_byline_and_affiliation",
        "current_role_backfilled": false,
        "human_review_status": "pending"
      }
    ],
    "professional_geographies": [
      "Switzerland"
    ],
    "operating_markets": [],
    "languages": [],
    "expertise_topics": [
      "AI agent security",
      "prompt injection evaluation"
    ],
    "authored_book_work_ids": [],
    "contributed_work_ids": [
      "source-BATCH-2026-005-006"
    ],
    "source_ids": [
      "source-BATCH-2026-005-006"
    ],
    "statement_ids": [
      "statement-BATCH-2026-006-022",
      "statement-BATCH-2026-006-023",
      "statement-BATCH-2026-006-024",
      "statement-BATCH-2026-006-025",
      "statement-BATCH-2026-006-026",
      "statement-BATCH-2026-006-027"
    ],
    "proposition_relationships": [],
    "relationship_to_off": "none_identified",
    "disclosure": null,
    "public_profile_eligibility": false,
    "verification_status": "identity_authorship_and_current_role_machine_verified_human_review_pending",
    "person_depth": "source_connected_dataset_only",
    "workflow_status": "metadata_verified",
    "machine_review_status": "ready_for_human_review",
    "human_review_status": "pending",
    "reviewed_by": null,
    "reviewed_at": null,
    "provenance": [
      {
        "source_url": "https://spylab.ai/",
        "accessed_at": "2026-08-15",
        "retrieval_method": "official institutional/company page or self-authored professional CV reviewed on the public web",
        "exact_locator": "People — Jie Zhang — PhD Student",
        "content_hash": null,
        "batch_id": "BATCH-2026-007",
        "prompt_id": "OEII-PERSON-RESEARCH",
        "prompt_version": "2.0",
        "notes": "Current-role evidence; named human review pending."
      },
      {
        "source_url": "https://arxiv.org/abs/2406.13352",
        "accessed_at": "2026-08-15",
        "retrieval_method": "inherited verified source metadata and author relationship cross-check",
        "exact_locator": "arXiv v3; byline/contributor relationship and source-time affiliation",
        "content_hash": "349884fffbf43282591c5accffd57bb651632f38e412fe303114941bdd111b05",
        "batch_id": "BATCH-2026-007",
        "prompt_id": "OEII-PERSON-RESEARCH",
        "prompt_version": "2.0",
        "notes": "Relationship inherited from BATCH-2026-005 and rechecked for this person batch; named human review pending."
      }
    ],
    "revision_history": [
      {
        "changed_at": "2026-08-15T22:30:00Z",
        "changed_by": "OpenAI Codex",
        "summary": "Created staging person record with identity disambiguation, source-time role separation, current-role verification, and intellectual-contribution links.",
        "batch_id": "BATCH-2026-007"
      }
    ]
  },
  {
    "person_id": "person-BATCH-2026-005-mislav-balunovic",
    "canonical_name": "Mislav Balunović",
    "display_name": "Mislav Balunović",
    "alternate_names": [
      "Mislav Balunovic",
      "M. Balunović",
      "M. Balunovic"
    ],
    "name_disambiguation_note": "The AgentDojo coauthor affiliated with ETH Zurich and Invariant Labs in the indexed source; diacritic-free author forms refer to the same person.",
    "external_identifiers": {